[
  {
    "risk_id": "RISK-001",
    "risk_level": "P0",
    "title": "Core project information is missing and blocks star-level judgment",
    "description": "The project profile contains missing fields or unconfirmed parameters: 围护结构热工参数, 窗墙比, 照明功率密度, 可再生能源系统方案, 绿色建材比例, 建筑能耗模拟结果, 采光模拟结果, has_energy_simulation_result, has_daylight_simulation_result, has_green_score_calculation, has_formal_calculation_report, envelope_thermal_parameters, lighting_power_density, renewable_energy_scheme, green_material_ratio",
    "trigger_clause_ids": [
      "GBT50378-2019-018",
      "GBT50378-2019-019",
      "GBT50378-2019-020",
      "GBT50378-2019-005",
      "GBT50378-2019-023",
      "GBT50378-2019-008"
    ],
    "trigger_gap_ids": [
      "GAP-001",
      "GAP-002",
      "GAP-003",
      "GAP-004",
      "GAP-005",
      "GAP-006",
      "GAP-007",
      "GAP-008",
      "GAP-009",
      "GAP-010",
      "GAP-011",
      "GAP-012",
      "GAP-013",
      "GAP-014",
      "GAP-015"
    ],
    "impact": "The system cannot form a reliable two-star precheck or three-star gap conclusion.",
    "mitigation": "Provide the missing project facts and confirm all false known_parameters before final review.",
    "next_action": "request_project_documents",
    "evidence_refs": [
      "GBT50378-2019-018",
      "GBT50378-2019-019",
      "GBT50378-2019-020",
      "GBT50378-2019-005",
      "GBT50378-2019-023",
      "GBT50378-2019-008"
    ]
  },
  {
    "risk_id": "RISK-002",
    "risk_level": "P1",
    "title": "Required calculation basis is missing",
    "description": "Some applicable clauses require calculation, but the project does not provide enough calculation basis such as simulation results, score calculation, or dedicated calculation reports.",
    "trigger_clause_ids": [
      "GBT50378-2019-004",
      "GBT50378-2019-003",
      "GBT50378-2019-018",
      "GBT50378-2019-019",
      "GBT50378-2019-020",
      "GBT50378-2019-029",
      "GBT50378-2019-031",
      "GBT50378-2019-005",
      "GBT50378-2019-007",
      "GBT50378-2019-022",
      "GBT50378-2019-008"
    ],
    "trigger_gap_ids": [
      "GAP-001",
      "GAP-002",
      "GAP-003",
      "GAP-004",
      "GAP-005",
      "GAP-006",
      "GAP-007",
      "GAP-008",
      "GAP-009",
      "GAP-010",
      "GAP-011",
      "GAP-012",
      "GAP-013",
      "GAP-014",
      "GAP-015"
    ],
    "impact": "The missing calculation basis may change the star-level conclusion or gap analysis result.",
    "mitigation": "Provide calculation reports, simulation outputs, and scoring worksheets for clauses requiring calculation.",
    "next_action": "perform_calculation",
    "evidence_refs": [
      "GBT50378-2019-004",
      "GBT50378-2019-003",
      "GBT50378-2019-018",
      "GBT50378-2019-019",
      "GBT50378-2019-020",
      "GBT50378-2019-029",
      "GBT50378-2019-031",
      "GBT50378-2019-005",
      "GBT50378-2019-007",
      "GBT50378-2019-022",
      "GBT50378-2019-008"
    ]
  },
  {
    "risk_id": "RISK-003",
    "risk_level": "P2",
    "title": "Manual review is required for applicable clauses",
    "description": "Some clauses are applicable or potentially applicable, but they require human review because of professional judgment boundaries, missing facts, or clause-level review requirements.",
    "trigger_clause_ids": [
      "GBT50378-2019-004",
      "GBT50378-2019-003",
      "GBT50378-2019-018",
      "GBT50378-2019-019",
      "GBT50378-2019-020",
      "GBT50378-2019-029",
      "GBT50378-2019-031",
      "GBT50378-2019-005",
      "GBT50378-2019-007",
      "GBT50378-2019-022",
      "GBT50378-2019-023",
      "GBT50378-2019-008"
    ],
    "trigger_gap_ids": [],
    "impact": "The automated result can be used as a precheck aid, but cannot be treated as a final review conclusion.",
    "mitigation": "Assign qualified reviewers to verify clause applicability, calculation assumptions, and evidence sufficiency.",
    "next_action": "perform_manual_review",
    "evidence_refs": [
      "GBT50378-2019-004",
      "GBT50378-2019-003",
      "GBT50378-2019-018",
      "GBT50378-2019-019",
      "GBT50378-2019-020",
      "GBT50378-2019-029",
      "GBT50378-2019-031",
      "GBT50378-2019-005",
      "GBT50378-2019-007",
      "GBT50378-2019-022",
      "GBT50378-2019-023",
      "GBT50378-2019-008"
    ]
  }
]